{
  "schema_version": "0.1.0",
  "proposal_id": "PRP-EVD-507572",
  "object_type": "evidence",
  "run_id": "RUN-OFS001-PILOT-003",
  "work_item_id": "WORK-000017",
  "source_result_ref": "proposals/sources/RUN-OFS001-PILOT-003/WORK-000004.json",
  "source_id": "SRC-9820B5E691E7",
  "origin_group_ids": [
    "ORG-DB523FE8ED5B"
  ],
  "has_primary_source": true,
  "created_by_agent_id": "extraction-public-01",
  "created_at": "2026-08-23T17:43:47.773001Z",
  "evidence_candidates": [
    {
      "schema_version": "0.1.0",
      "evidence_id": "EVD-263A0252B407",
      "run_id": "RUN-OFS001-PILOT-003",
      "work_item_id": "WORK-000017",
      "source_id": "SRC-9820B5E691E7",
      "source_lineage_id": "LIN-FE079B9A27D1",
      "source_locator": "The Science, The Impact, and Summary sections",
      "excerpt": "The DOE summary says heterogeneous supercomputer memory requires runtime data-placement software because applications and existing software do not automatically map data well across fast-small and slow-large tiers; the cited framework monitors use and moves individual objects on real systems.",
      "excerpt_kind": "paraphrase",
      "statement_supported": "AI-for-science memory architecture evaluation must include placement-policy quality and runtime migration overhead, not only device bandwidth and capacity.",
      "status": "candidate",
      "extracted_by_agent_id": "extraction-public-01",
      "extracted_at": "2026-08-23T17:43:47.773001Z",
      "evidence_hash": "263a0252b4076e8f7ffdf03ee2812e8633f1b905fd4bb29e46154ab53a371361"
    }
  ]
}
