{
  "schema_version": "0.1.0",
  "proposal_id": "PRP-EVD-693415",
  "object_type": "evidence",
  "run_id": "RUN-OFS003-PILOT-001",
  "work_item_id": "WORK-000041",
  "source_result_ref": "proposals/sources/RUN-OFS003-PILOT-001/WORK-000008.json",
  "source_id": "SRC-F63C76AC59AF",
  "origin_group_ids": [
    "ORG-C41FE0668568"
  ],
  "has_primary_source": true,
  "created_by_agent_id": "extraction-public-01",
  "created_at": "2026-08-23T18:36:15.735119Z",
  "evidence_candidates": [
    {
      "schema_version": "0.1.0",
      "evidence_id": "EVD-D3588342A48D",
      "run_id": "RUN-OFS003-PILOT-001",
      "work_item_id": "WORK-000041",
      "source_id": "SRC-F63C76AC59AF",
      "source_lineage_id": "LIN-5F7325F816B3",
      "source_locator": "resource row for CENTER-TOHOKU-CSC",
      "excerpt": "The table lists AOBA-S, AOBA-A, and AOBA-B at Tohoku University, including SX-Aurora TSUBASA and LX 406Rz-2 resources.",
      "excerpt_kind": "paraphrase",
      "statement_supported": "Tohoku University provides three AOBA subsystems in FY2026.",
      "status": "candidate",
      "extracted_by_agent_id": "extraction-public-01",
      "extracted_at": "2026-08-23T18:36:15.735119Z",
      "evidence_hash": "d3588342a48dc1216b35bc220a4cdeabd2c7c89864d43e9a023c6118a1569f1f"
    }
  ]
}
