{
  "schema_version": "0.1.0",
  "proposal_id": "PRP-EVD-676998",
  "object_type": "evidence",
  "run_id": "RUN-OFS005-PILOT-007",
  "work_item_id": "WORK-000024",
  "source_result_ref": "proposals/sources/RUN-OFS005-PILOT-007/WORK-000008.json",
  "source_id": "SRC-D8A0204D468A",
  "origin_group_ids": [
    "ORG-2DB358DA2536"
  ],
  "has_primary_source": true,
  "created_by_agent_id": "extraction-public-01",
  "created_at": "2026-08-23T20:22:54.191992Z",
  "evidence_candidates": [
    {
      "schema_version": "0.1.0",
      "evidence_id": "EVD-DA86F47624C6",
      "run_id": "RUN-OFS005-PILOT-007",
      "work_item_id": "WORK-000024",
      "source_id": "SRC-D8A0204D468A",
      "source_lineage_id": "LIN-CE5BE8B5C299",
      "source_locator": "光電融合技術・ディスアグリゲーションの説明",
      "excerpt": "NEDOは、データセンター内の短距離通信にも光電融合技術を導入し、光ネットワーク、省エネ型プロセッサ・メモリ・ストレージとディスアグリゲーション制御を組み合わせて、データセンター全体の高効率化を目指す研究開発を説明している。",
      "excerpt_kind": "paraphrase",
      "statement_supported": "日本の公的研究開発戦略は、AI・データセンターの通信電力と拡張性の課題に対し、光電融合と複数技術層の協調を主要な解決経路として位置づけている。",
      "status": "candidate",
      "extracted_by_agent_id": "extraction-public-01",
      "extracted_at": "2026-08-23T20:22:54.191992Z",
      "evidence_hash": "da86f47624c6ae60cd0cbcaf5ea41f5fea4dd60b65a449df7ba79cb7aeee839e"
    }
  ]
}
