{
  "schema_version": "0.1.0",
  "proposal_id": "PRP-EVD-703134",
  "object_type": "evidence",
  "run_id": "RUN-OFS003-PILOT-002",
  "work_item_id": "WORK-000057",
  "source_result_ref": "proposals/sources/RUN-OFS003-PILOT-002/WORK-000009.json",
  "source_id": "SRC-9111705EA963",
  "origin_group_ids": [
    "ORG-77B96A7AB57A"
  ],
  "has_primary_source": true,
  "created_by_agent_id": "extraction-public-01",
  "created_at": "2026-08-23T18:59:38.523437Z",
  "evidence_candidates": [
    {
      "schema_version": "0.1.0",
      "evidence_id": "EVD-A90A9DDCC6D6",
      "run_id": "RUN-OFS003-PILOT-002",
      "work_item_id": "WORK-000057",
      "source_id": "SRC-9111705EA963",
      "source_lineage_id": "LIN-A7D722DB31AF",
      "source_locator": "official service or system overview",
      "excerpt": "The AOBA manual index covers application procedures, fees, login, programming, applications, front ends, storage, and facility use.",
      "excerpt_kind": "paraphrase",
      "statement_supported": "Tohoku publishes operational guidance spanning AOBA access, software, storage, and facility use.",
      "status": "candidate",
      "extracted_by_agent_id": "extraction-public-01",
      "extracted_at": "2026-08-23T18:59:38.523437Z",
      "evidence_hash": "a90a9ddcc6d63d45ec901a379fab799ccbdf402cce98ffcf67acd77877dcd1cf"
    }
  ]
}
