{
  "schema_version": "0.1.0",
  "proposal_id": "PRP-EVD-375805",
  "object_type": "evidence",
  "run_id": "RUN-OFS003-PILOT-004",
  "work_item_id": "WORK-000082",
  "source_result_ref": "proposals/sources/RUN-OFS003-PILOT-004/WORK-000034.json",
  "source_id": "SRC-A354A335A424",
  "origin_group_ids": [
    "ORG-8A7C0FAA8DBA"
  ],
  "has_primary_source": true,
  "created_by_agent_id": "extraction-public-01",
  "created_at": "2026-08-23T19:16:40.292834Z",
  "evidence_candidates": [
    {
      "schema_version": "0.1.0",
      "evidence_id": "EVD-1D14F2A226E7",
      "run_id": "RUN-OFS003-PILOT-004",
      "work_item_id": "WORK-000082",
      "source_id": "SRC-A354A335A424",
      "source_lineage_id": "LIN-BD589C2100BC",
      "source_locator": "operation schedule and service-environment sections",
      "excerpt": "AIST announced a phased ABCI 3.0 transition: partial service in October 2024, trial use in November, completion of the replacement in December, and general service from January 2025. It also describes shared-storage use and an AI-ready software environment.",
      "excerpt_kind": "paraphrase",
      "statement_supported": "ABCI 3.0 used a dated phased transition and retained shared-storage and AI software services.",
      "status": "candidate",
      "extracted_by_agent_id": "extraction-public-01",
      "extracted_at": "2026-08-23T19:16:40.292834Z",
      "evidence_hash": "1d14f2a226e7bb4bf3162ed4487f162308a3b3e0e9d3449bb64a2e37661e63e9"
    }
  ]
}
