{
  "schema_version": "0.1.0",
  "proposal_id": "PRP-EVD-523756",
  "object_type": "evidence",
  "run_id": "RUN-OFS003-PILOT-001",
  "work_item_id": "WORK-000059",
  "source_result_ref": "proposals/sources/RUN-OFS003-PILOT-001/WORK-000026.json",
  "source_id": "SRC-F63C76AC59AF",
  "origin_group_ids": [
    "ORG-C41FE0668568"
  ],
  "has_primary_source": true,
  "created_by_agent_id": "extraction-public-01",
  "created_at": "2026-08-23T18:36:15.804235Z",
  "evidence_candidates": [
    {
      "schema_version": "0.1.0",
      "evidence_id": "EVD-071334CF8490",
      "run_id": "RUN-OFS003-PILOT-001",
      "work_item_id": "WORK-000059",
      "source_id": "SRC-F63C76AC59AF",
      "source_lineage_id": "LIN-5F7325F816B3",
      "source_locator": "resource row for CENTER-JCAHPC",
      "excerpt": "The table lists Miyabi-G accelerator nodes and Miyabi-C general-purpose CPU nodes under JCAHPC.",
      "excerpt_kind": "paraphrase",
      "statement_supported": "JCAHPC provides Miyabi-G and Miyabi-C resources in FY2026.",
      "status": "candidate",
      "extracted_by_agent_id": "extraction-public-01",
      "extracted_at": "2026-08-23T18:36:15.804235Z",
      "evidence_hash": "071334cf8490196fc1d97eca6ab3ae095f55796a5f29b46dc38b05d54d1e08ae"
    }
  ]
}
