{
  "schema_version": "0.1.0",
  "proposal_id": "PRP-EVD-138598",
  "object_type": "evidence",
  "run_id": "RUN-OFS005-PILOT-006",
  "work_item_id": "WORK-000030",
  "source_result_ref": "proposals/sources/RUN-OFS005-PILOT-006/WORK-000014.json",
  "source_id": "SRC-E4DB94C61A80",
  "origin_group_ids": [
    "ORG-F38DDEC02026"
  ],
  "has_primary_source": true,
  "created_by_agent_id": "extraction-public-01",
  "created_at": "2026-08-23T20:18:07.731751Z",
  "evidence_candidates": [
    {
      "schema_version": "0.1.0",
      "evidence_id": "EVD-DF9E76917207",
      "run_id": "RUN-OFS005-PILOT-006",
      "work_item_id": "WORK-000030",
      "source_id": "SRC-E4DB94C61A80",
      "source_lineage_id": "LIN-8CDEF4281F42",
      "source_locator": "abstract and research-output description",
      "excerpt": "The peer-reviewed SC23 contribution describes Frontier's compute, interconnect, storage and software architecture, evaluates microbenchmarks and real applications, and examines where the deployed system meets or falls short of earlier exascale expectations.",
      "excerpt_kind": "paraphrase",
      "statement_supported": "Peer-reviewed studies of Fugaku and Frontier evaluate supercomputer architecture together with software and application behavior rather than relying on peak performance alone.",
      "status": "candidate",
      "extracted_by_agent_id": "extraction-public-01",
      "extracted_at": "2026-08-23T20:18:07.731751Z",
      "evidence_hash": "df9e769172077ea74bb8fe372113f9019a5bce80ed9636e62ecd19e99607cee8"
    }
  ]
}
