{
  "schema_version": "0.1.0",
  "proposal_id": "PRP-EVD-863236",
  "object_type": "evidence",
  "run_id": "RUN-OFS003-PILOT-004",
  "work_item_id": "WORK-000085",
  "source_result_ref": "proposals/sources/RUN-OFS003-PILOT-004/WORK-000037.json",
  "source_id": "SRC-D386B9780052",
  "origin_group_ids": [
    "ORG-C8A4F9B3DD87"
  ],
  "has_primary_source": true,
  "created_by_agent_id": "extraction-public-01",
  "created_at": "2026-08-23T19:16:40.308031Z",
  "evidence_candidates": [
    {
      "schema_version": "0.1.0",
      "evidence_id": "EVD-89A7AD439328",
      "run_id": "RUN-OFS003-PILOT-004",
      "work_item_id": "WORK-000085",
      "source_id": "SRC-D386B9780052",
      "source_lineage_id": "LIN-0389432E5579",
      "source_locator": "system overview, network, and storage specifications",
      "excerpt": "JAMSTEC documents ES4's three node types on a common HDR200 InfiniBand fabric, with approximately 1.3 PB high-speed storage and 60 PB large-capacity storage.",
      "excerpt_kind": "paraphrase",
      "statement_supported": "ES4 integrates heterogeneous compute and two storage tiers through a common high-speed fabric.",
      "status": "candidate",
      "extracted_by_agent_id": "extraction-public-01",
      "extracted_at": "2026-08-23T19:16:40.308031Z",
      "evidence_hash": "89a7ad439328d81b2ef59b1cedd49bb8b90bfd984dae51d2014e0901fa60e8d5"
    }
  ]
}
