{
  "schema_version": "0.1.0",
  "proposal_id": "PRP-EVD-797163",
  "object_type": "evidence",
  "run_id": "RUN-OFS003-PILOT-005",
  "work_item_id": "WORK-000058",
  "source_result_ref": "proposals/sources/RUN-OFS003-PILOT-005/WORK-000010.json",
  "source_id": "SRC-F63C76AC59AF",
  "origin_group_ids": [
    "ORG-C41FE0668568"
  ],
  "has_primary_source": true,
  "created_by_agent_id": "extraction-public-01",
  "created_at": "2026-08-23T19:37:42.901178Z",
  "evidence_candidates": [
    {
      "schema_version": "0.1.0",
      "evidence_id": "EVD-5536B50AD484",
      "run_id": "RUN-OFS003-PILOT-005",
      "work_item_id": "WORK-000058",
      "source_id": "SRC-F63C76AC59AF",
      "source_lineage_id": "LIN-5F7325F816B3",
      "source_locator": "resource row for CENTER-TSUKUBA-CCS",
      "excerpt": "The table lists both Pegasus and Sirius (PACS12.0) at the University of Tsukuba for FY2026 allocations.",
      "excerpt_kind": "paraphrase",
      "statement_supported": "Tsukuba provides Pegasus and Sirius (PACS12.0) resources in FY2026.",
      "status": "candidate",
      "extracted_by_agent_id": "extraction-public-01",
      "extracted_at": "2026-08-23T19:37:42.901178Z",
      "evidence_hash": "5536b50ad4849f400fb3b116936de68eb3ed273ae811dcb2cc184dc5766882d5"
    }
  ]
}
