{
  "schema_version": "0.1.0",
  "proposal_id": "PRP-EVD-684778",
  "object_type": "evidence",
  "run_id": "RUN-OFS003-PILOT-001",
  "work_item_id": "WORK-000060",
  "source_result_ref": "proposals/sources/RUN-OFS003-PILOT-001/WORK-000027.json",
  "source_id": "SRC-C3A80037370E",
  "origin_group_ids": [
    "ORG-6F49E345F808"
  ],
  "has_primary_source": true,
  "created_by_agent_id": "extraction-public-01",
  "created_at": "2026-08-23T18:36:15.808459Z",
  "evidence_candidates": [
    {
      "schema_version": "0.1.0",
      "evidence_id": "EVD-E5B8C1C0FDE4",
      "run_id": "RUN-OFS003-PILOT-001",
      "work_item_id": "WORK-000060",
      "source_id": "SRC-C3A80037370E",
      "source_lineage_id": "LIN-136B392A7420",
      "source_locator": "official service or system overview",
      "excerpt": "The Miyabi program offers periodic large-scale challenge access to both Miyabi-G GPU nodes and Miyabi-C CPU nodes under JCAHPC.",
      "excerpt_kind": "paraphrase",
      "statement_supported": "JCAHPC provides coordinated access to Miyabi-G and Miyabi-C, including large-scale challenge use.",
      "status": "candidate",
      "extracted_by_agent_id": "extraction-public-01",
      "extracted_at": "2026-08-23T18:36:15.808459Z",
      "evidence_hash": "e5b8c1c0fde4fb7f1a73ee0ee6cd607a084770cdd8cfca3d9f0704e764f8af10"
    }
  ]
}
