{
  "schema_version": "0.1.0",
  "proposal_id": "PRP-EVD-016924",
  "object_type": "evidence",
  "run_id": "RUN-OFS001-PILOT-003",
  "work_item_id": "WORK-000019",
  "source_result_ref": "proposals/sources/RUN-OFS001-PILOT-003/WORK-000006.json",
  "source_id": "SRC-6D52CAD2F671",
  "origin_group_ids": [
    "ORG-8286546BD0BF"
  ],
  "has_primary_source": true,
  "created_by_agent_id": "extraction-public-01",
  "created_at": "2026-08-23T17:43:48.048180Z",
  "evidence_candidates": [
    {
      "schema_version": "0.1.0",
      "evidence_id": "EVD-7437F73D22B8",
      "run_id": "RUN-OFS001-PILOT-003",
      "work_item_id": "WORK-000019",
      "source_id": "SRC-6D52CAD2F671",
      "source_lineage_id": "LIN-28D605408E8D",
      "source_locator": "Section 3 performance characterization and Table 1",
      "excerpt": "The ICS 2026 paper measures a switched CXL memory pool and reports local DRAM and pooled-memory CPU access latencies of 214 ns and 658 ns in its setup. It also evaluates GPU transfers, contention, and scaling across CXL devices, while noting that pools lack hardware-managed cache-line interleaving across devices.",
      "excerpt_kind": "paraphrase",
      "statement_supported": "A 2026 real-platform CXL pool study shows that latency, cross-device balance, contention, and transfer direction must be explicit dimensions in evaluating pooled memory for GPU communication.",
      "status": "candidate",
      "extracted_by_agent_id": "extraction-public-01",
      "extracted_at": "2026-08-23T17:43:48.048180Z",
      "evidence_hash": "7437f73d22b88a36486c3304a0e7ce83717f14eb5c99e500400069b917bafacf"
    }
  ]
}
