{
  "schema_version": "0.1.0",
  "proposal_id": "PRP-EVD-925000",
  "object_type": "evidence",
  "run_id": "RUN-OFS005-PILOT-006",
  "work_item_id": "WORK-000020",
  "source_result_ref": "proposals/sources/RUN-OFS005-PILOT-006/WORK-000004.json",
  "source_id": "SRC-DAA06E7E0E0E",
  "origin_group_ids": [
    "ORG-EC71874A225A"
  ],
  "has_primary_source": true,
  "created_by_agent_id": "extraction-public-01",
  "created_at": "2026-08-23T20:18:07.702841Z",
  "evidence_candidates": [
    {
      "schema_version": "0.1.0",
      "evidence_id": "EVD-519259D0F923",
      "run_id": "RUN-OFS005-PILOT-006",
      "work_item_id": "WORK-000020",
      "source_id": "SRC-DAA06E7E0E0E",
      "source_lineage_id": "LIN-34CC59F6F668",
      "source_locator": "procurement-history and revised-plan paragraphs",
      "excerpt": "KISTI reported that an earlier procurement for its sixth national supercomputer failed after generative-AI demand increased GPU demand and prices. The revised plan increased the budget by 53 percent, extended the schedule, and targeted service in the first half of 2026.",
      "excerpt_kind": "paraphrase",
      "statement_supported": "Public supercomputing plans are being reshaped by AI and data-infrastructure demand while funding, procurement and component-supply constraints alter deployment paths.",
      "status": "candidate",
      "extracted_by_agent_id": "extraction-public-01",
      "extracted_at": "2026-08-23T20:18:07.702841Z",
      "evidence_hash": "519259d0f9230d8cef136af0f2adf7470c46ec18b3dbdc6a6e498808d438c0ad"
    }
  ]
}
