{
  "schema_version": "0.1.0",
  "proposal_id": "PRP-EVD-730211",
  "object_type": "evidence",
  "run_id": "RUN-OFS003-PILOT-001",
  "work_item_id": "WORK-000056",
  "source_result_ref": "proposals/sources/RUN-OFS003-PILOT-001/WORK-000023.json",
  "source_id": "SRC-3DC57D634241",
  "origin_group_ids": [
    "ORG-32618901D619"
  ],
  "has_primary_source": true,
  "created_by_agent_id": "extraction-public-01",
  "created_at": "2026-08-23T18:36:15.791049Z",
  "evidence_candidates": [
    {
      "schema_version": "0.1.0",
      "evidence_id": "EVD-E314A271EB26",
      "run_id": "RUN-OFS003-PILOT-001",
      "work_item_id": "WORK-000056",
      "source_id": "SRC-3DC57D634241",
      "source_lineage_id": "LIN-322B719128F5",
      "source_locator": "official service or system overview",
      "excerpt": "The guide defines project-based allocation, account creation, shared points, and storage, including 1 TB with the base fee and optional expansion.",
      "excerpt_kind": "paraphrase",
      "statement_supported": "Genkai uses project-based accounts with shared compute points and configurable storage.",
      "status": "candidate",
      "extracted_by_agent_id": "extraction-public-01",
      "extracted_at": "2026-08-23T18:36:15.791049Z",
      "evidence_hash": "e314a271eb26abe0541058c74656e7c94c4cbab67b724cd3c350abbdf80d5ed6"
    }
  ]
}
