{
  "schema_version": "0.1.0",
  "proposal_id": "PRP-EVD-146310",
  "object_type": "evidence",
  "run_id": "RUN-OFS003-PILOT-002",
  "work_item_id": "WORK-000084",
  "source_result_ref": "proposals/sources/RUN-OFS003-PILOT-002/WORK-000037.json",
  "source_id": "SRC-8EC72721E5E3",
  "origin_group_ids": [
    "ORG-3AE5A90E8B3A"
  ],
  "has_primary_source": true,
  "created_by_agent_id": "extraction-public-01",
  "created_at": "2026-08-23T18:59:38.655530Z",
  "evidence_candidates": [
    {
      "schema_version": "0.1.0",
      "evidence_id": "EVD-6AB3BA85B09F",
      "run_id": "RUN-OFS003-PILOT-002",
      "work_item_id": "WORK-000084",
      "source_id": "SRC-8EC72721E5E3",
      "source_lineage_id": "LIN-DB97010DCF09",
      "source_locator": "Earth Simulator renewal and operation chronology",
      "excerpt": "JAMSTEC reports that ES4 procurement and transition targeted higher energy efficiency, with installation and trial operation preceding formal service in 2021.",
      "excerpt_kind": "paraphrase",
      "statement_supported": "The ES4 transition provides historical evidence of an energy-efficiency-led refresh process.",
      "status": "candidate",
      "extracted_by_agent_id": "extraction-public-01",
      "extracted_at": "2026-08-23T18:59:38.655530Z",
      "evidence_hash": "6ab3ba85b09f1cff5079d3c754d28854de028717373f67847748c8b119f8518e"
    }
  ]
}
