{
  "schema_version": "0.1.0",
  "proposal_id": "PRP-EVD-233707",
  "object_type": "evidence",
  "run_id": "RUN-OFS003-PILOT-004",
  "work_item_id": "WORK-000066",
  "source_result_ref": "proposals/sources/RUN-OFS003-PILOT-004/WORK-000018.json",
  "source_id": "SRC-F63C76AC59AF",
  "origin_group_ids": [
    "ORG-C41FE0668568"
  ],
  "has_primary_source": true,
  "created_by_agent_id": "extraction-public-01",
  "created_at": "2026-08-23T19:16:40.211579Z",
  "evidence_candidates": [
    {
      "schema_version": "0.1.0",
      "evidence_id": "EVD-BDE405CA71F2",
      "run_id": "RUN-OFS003-PILOT-004",
      "work_item_id": "WORK-000066",
      "source_id": "SRC-F63C76AC59AF",
      "source_lineage_id": "LIN-5F7325F816B3",
      "source_locator": "resource row for CENTER-KYOTO-ACCMS",
      "excerpt": "The table lists Camphor3 (System A) at Kyoto University for general, early-career, and industrial allocation classes.",
      "excerpt_kind": "paraphrase",
      "statement_supported": "Kyoto University provides Camphor3 resources in FY2026.",
      "status": "candidate",
      "extracted_by_agent_id": "extraction-public-01",
      "extracted_at": "2026-08-23T19:16:40.211579Z",
      "evidence_hash": "bde405ca71f2430ecba3b932b2a67fef3751db039364010936a45a5f82b2b3f9"
    }
  ]
}
