{
  "schema_version": "0.1.0",
  "proposal_id": "PRP-EVD-911581",
  "object_type": "evidence",
  "run_id": "RUN-OFS003-PILOT-002",
  "work_item_id": "WORK-000085",
  "source_result_ref": "proposals/sources/RUN-OFS003-PILOT-002/WORK-000038.json",
  "source_id": "SRC-B2BE6A5FEF64",
  "origin_group_ids": [
    "ORG-EB2ECE766893"
  ],
  "has_primary_source": true,
  "created_by_agent_id": "extraction-public-01",
  "created_at": "2026-08-23T18:59:38.660567Z",
  "evidence_candidates": [
    {
      "schema_version": "0.1.0",
      "evidence_id": "EVD-1F11556E3E57",
      "run_id": "RUN-OFS003-PILOT-002",
      "work_item_id": "WORK-000085",
      "source_id": "SRC-B2BE6A5FEF64",
      "source_lineage_id": "LIN-1B27D3F76A4F",
      "source_locator": "Miyabi overview and system configuration",
      "excerpt": "JCAHPC states that Miyabi began operation in January 2025 and documents its GPU and CPU node architecture, interconnect, and storage.",
      "excerpt_kind": "paraphrase",
      "statement_supported": "Miyabi's January 2025 start is an official recent refresh milestone for JCAHPC.",
      "status": "candidate",
      "extracted_by_agent_id": "extraction-public-01",
      "extracted_at": "2026-08-23T18:59:38.660567Z",
      "evidence_hash": "1f11556e3e576ea97a436020bf43f2213f547d01b094cc57038e0039c1c70f91"
    }
  ]
}
