{
  "schema_version": "0.1.0",
  "proposal_id": "PRP-EVD-524445",
  "object_type": "evidence",
  "run_id": "RUN-OFS003-PILOT-002",
  "work_item_id": "WORK-000050",
  "source_result_ref": "proposals/sources/RUN-OFS003-PILOT-002/WORK-000002.json",
  "source_id": "SRC-64A65E840C31",
  "origin_group_ids": [
    "ORG-1716076D6EFC"
  ],
  "has_primary_source": true,
  "created_by_agent_id": "extraction-public-01",
  "created_at": "2026-08-23T18:59:38.489871Z",
  "evidence_candidates": [
    {
      "schema_version": "0.1.0",
      "evidence_id": "EVD-1F0AF957B9B7",
      "run_id": "RUN-OFS003-PILOT-002",
      "work_item_id": "WORK-000050",
      "source_id": "SRC-64A65E840C31",
      "source_lineage_id": "LIN-6FBB97B1A3D3",
      "source_locator": "FY2026 resource overview",
      "excerpt": "The FY2026 page publishes the hardware and software resources available for HPCI applications and links the revised allocation table.",
      "excerpt_kind": "paraphrase",
      "statement_supported": "HPCI publishes a fiscal-year-specific resource inventory for applications.",
      "status": "candidate",
      "extracted_by_agent_id": "extraction-public-01",
      "extracted_at": "2026-08-23T18:59:38.489871Z",
      "evidence_hash": "1f0af957b9b7ff4d92da214756b9472f098d722cc9d79cf436b1480d06a8f5af"
    }
  ]
}
