{
  "schema_version": "0.1.0",
  "proposal_id": "PRP-EVD-410564",
  "object_type": "evidence",
  "run_id": "RUN-OFS003-PILOT-005",
  "work_item_id": "WORK-000080",
  "source_result_ref": "proposals/sources/RUN-OFS003-PILOT-005/WORK-000032.json",
  "source_id": "SRC-F63C76AC59AF",
  "origin_group_ids": [
    "ORG-C41FE0668568"
  ],
  "has_primary_source": true,
  "created_by_agent_id": "extraction-public-01",
  "created_at": "2026-08-23T19:37:42.988181Z",
  "evidence_candidates": [
    {
      "schema_version": "0.1.0",
      "evidence_id": "EVD-2CDF7DDE0742",
      "run_id": "RUN-OFS003-PILOT-005",
      "work_item_id": "WORK-000080",
      "source_id": "SRC-F63C76AC59AF",
      "source_lineage_id": "LIN-5F7325F816B3",
      "source_locator": "resource row for CENTER-AIST-IHF",
      "excerpt": "The independent-rule section lists ABCI 3.0 at AIST while marking the HPCI resource amount as not yet determined.",
      "excerpt_kind": "paraphrase",
      "statement_supported": "The FY2026 table did not yet specify the amount of ABCI 3.0 HPCI resources.",
      "status": "candidate",
      "extracted_by_agent_id": "extraction-public-01",
      "extracted_at": "2026-08-23T19:37:42.988181Z",
      "evidence_hash": "2cdf7dde07425422a24983ba1490321572a60033937a266d5b0b27f54fcabccc"
    }
  ]
}
