{
  "schema_version": "0.1.0",
  "proposal_id": "PRP-EVD-208180",
  "object_type": "evidence",
  "run_id": "RUN-OFS003-PILOT-002",
  "work_item_id": "WORK-000069",
  "source_result_ref": "proposals/sources/RUN-OFS003-PILOT-002/WORK-000021.json",
  "source_id": "SRC-05C70893DFB5",
  "origin_group_ids": [
    "ORG-3993E3238B66"
  ],
  "has_primary_source": true,
  "created_by_agent_id": "extraction-public-01",
  "created_at": "2026-08-23T18:59:38.580611Z",
  "evidence_candidates": [
    {
      "schema_version": "0.1.0",
      "evidence_id": "EVD-BC32FF7D6542",
      "run_id": "RUN-OFS003-PILOT-002",
      "work_item_id": "WORK-000069",
      "source_id": "SRC-05C70893DFB5",
      "source_lineage_id": "LIN-B947A79B1668",
      "source_locator": "official service or system overview",
      "excerpt": "The center plans to end SQUID and ONION service on June 30, 2027 and says a successor is not yet decided, creating a potential same-scale resource gap.",
      "excerpt_kind": "paraphrase",
      "statement_supported": "Osaka plans to end SQUID and ONION in June 2027 while a successor remains undecided.",
      "status": "candidate",
      "extracted_by_agent_id": "extraction-public-01",
      "extracted_at": "2026-08-23T18:59:38.580611Z",
      "evidence_hash": "bc32ff7d6542e7756775ab8f4bfdb1937db15a08d86fa14871890292ec891b19"
    }
  ]
}
