{
  "schema_version": "0.1.0",
  "proposal_id": "PRP-EVD-824303",
  "object_type": "evidence",
  "run_id": "RUN-OFS005-PILOT-002",
  "work_item_id": "WORK-000008",
  "source_result_ref": "proposals/sources/RUN-OFS005-PILOT-002/WORK-000002.json",
  "source_id": "SRC-CED9E60B8397",
  "origin_group_ids": [
    "ORG-5552052C93DC"
  ],
  "has_primary_source": true,
  "created_by_agent_id": "extraction-public-01",
  "created_at": "2026-08-23T20:04:41.580473Z",
  "evidence_candidates": [
    {
      "schema_version": "0.1.0",
      "evidence_id": "EVD-F42625212554",
      "run_id": "RUN-OFS005-PILOT-002",
      "work_item_id": "WORK-000008",
      "source_id": "SRC-CED9E60B8397",
      "source_lineage_id": "LIN-009F1F465F6B",
      "source_locator": "FY2026 Congressional Justification, pages 4-5",
      "excerpt": "The FY2026 ASCR request supports ESnet6 operation and Integrated Research Infrastructure development. It provides no line-item construction funding for the High Performance Data Facility, instead retaining a phased final-design approach, and describes continuing AI, advanced-computing and quantum coordination.",
      "excerpt_kind": "paraphrase",
      "statement_supported": "The FY2026 ASCR request combines exascale and AI infrastructure work with ESnet6 and IRI, while retaining a phased design option rather than line-item construction funding for HPDF.",
      "status": "candidate",
      "extracted_by_agent_id": "extraction-public-01",
      "extracted_at": "2026-08-23T20:04:41.580473Z",
      "evidence_hash": "f426252125549845d97674dd6b5d5133e03f171e14ef32736c6810a9cd5dabe9"
    }
  ]
}
