{
  "schema_version": "0.1.0",
  "proposal_id": "PRP-EVD-377382",
  "object_type": "evidence",
  "run_id": "RUN-OFS001-PILOT-002",
  "work_item_id": "WORK-000015",
  "source_result_ref": "proposals/sources/RUN-OFS001-PILOT-002/WORK-000003.json",
  "source_id": "SRC-3B585C8C7747",
  "origin_group_ids": [
    "ORG-44F56A21D7C3"
  ],
  "has_primary_source": true,
  "created_by_agent_id": "extraction-public-01",
  "created_at": "2026-08-23T17:11:01.922191Z",
  "evidence_candidates": [
    {
      "schema_version": "0.1.0",
      "evidence_id": "EVD-F651FE5A1EF2",
      "run_id": "RUN-OFS001-PILOT-002",
      "work_item_id": "WORK-000015",
      "source_id": "SRC-3B585C8C7747",
      "source_lineage_id": "LIN-C3A482E8E152",
      "source_locator": "6-7ページ",
      "excerpt": "FS3.0概要は、AI for ScienceとHPCの双方を対象に、HBMやCXLを使う大容量・高帯域メモリと階層的アクセス管理を検討し、アプリケーション要求をアーキテクチャ要件へフィードバックする方針を示している。",
      "excerpt_kind": "paraphrase",
      "statement_supported": "FS3.0の公開概要は、HBM・CXL・階層管理とアプリケーション要求の接続を次世代HPCIアーキテクチャ調査の対象としている。",
      "status": "candidate",
      "extracted_by_agent_id": "extraction-public-01",
      "extracted_at": "2026-08-23T17:11:01.922191Z",
      "evidence_hash": "f651fe5a1ef2c402eac34eeee2ca88e3ec846d585cdedf4a0b940bbff85c78c6"
    }
  ]
}
