{
  "schema_version": "0.1.0",
  "proposal_id": "PRP-EVD-856422",
  "object_type": "evidence",
  "run_id": "RUN-OFS003-PILOT-002",
  "work_item_id": "WORK-000062",
  "source_result_ref": "proposals/sources/RUN-OFS003-PILOT-002/WORK-000014.json",
  "source_id": "SRC-F63C76AC59AF",
  "origin_group_ids": [
    "ORG-C41FE0668568"
  ],
  "has_primary_source": true,
  "created_by_agent_id": "extraction-public-01",
  "created_at": "2026-08-23T18:59:38.547607Z",
  "evidence_candidates": [
    {
      "schema_version": "0.1.0",
      "evidence_id": "EVD-8E08B00F825A",
      "run_id": "RUN-OFS003-PILOT-002",
      "work_item_id": "WORK-000062",
      "source_id": "SRC-F63C76AC59AF",
      "source_lineage_id": "LIN-5F7325F816B3",
      "source_locator": "resource row for CENTER-SCIENCE-TOKYO-IIC",
      "excerpt": "The table lists TSUBAME4.0 shared resources in quarterly allocation periods under Institute of Science Tokyo.",
      "excerpt_kind": "paraphrase",
      "statement_supported": "Institute of Science Tokyo provides TSUBAME4.0 resources in FY2026.",
      "status": "candidate",
      "extracted_by_agent_id": "extraction-public-01",
      "extracted_at": "2026-08-23T18:59:38.547607Z",
      "evidence_hash": "8e08b00f825a2b60b6560a40497d0bb8d3678af301c1e39a7c4a7d1d8a9e6fac"
    }
  ]
}
