{
  "schema_version": "0.1.0",
  "proposal_id": "PRP-EVD-294962",
  "object_type": "evidence",
  "run_id": "RUN-OFS003-PILOT-004",
  "work_item_id": "WORK-000090",
  "source_result_ref": "proposals/sources/RUN-OFS003-PILOT-004/WORK-000042.json",
  "source_id": "SRC-A9D80B908286",
  "origin_group_ids": [
    "ORG-64D027DBA7CE"
  ],
  "has_primary_source": true,
  "created_by_agent_id": "extraction-public-01",
  "created_at": "2026-08-23T19:16:40.333608Z",
  "evidence_candidates": [
    {
      "schema_version": "0.1.0",
      "evidence_id": "EVD-BBF4CBD7CE5E",
      "run_id": "RUN-OFS003-PILOT-004",
      "work_item_id": "WORK-000090",
      "source_id": "SRC-A9D80B908286",
      "source_lineage_id": "LIN-3E50341928D8",
      "source_locator": "data-center cooling and power-upgrade sections",
      "excerpt": "Osaka reports that SQUID introduction required power and cooling upgrades. The existing N+1 cooling configuration left about 1,200 kW available for SQUID before the upgrade and motivated coordinated facility work.",
      "excerpt_kind": "paraphrase",
      "statement_supported": "SQUID procurement exposed quantified cooling capacity constraints and required facility upgrades.",
      "status": "candidate",
      "extracted_by_agent_id": "extraction-public-01",
      "extracted_at": "2026-08-23T19:16:40.333608Z",
      "evidence_hash": "bbf4cbd7ce5e5c2d8ccffe277267a99929d50e371124b3f1bf39e90e89ab1db1"
    }
  ]
}
