{
  "schema_version": "0.1.0",
  "proposal_id": "PRP-EVD-394163",
  "object_type": "evidence",
  "run_id": "RUN-OFS005-PILOT-007",
  "work_item_id": "WORK-000025",
  "source_result_ref": "proposals/sources/RUN-OFS005-PILOT-007/WORK-000009.json",
  "source_id": "SRC-15E66CBE961E",
  "origin_group_ids": [
    "ORG-DC5955727F85"
  ],
  "has_primary_source": true,
  "created_by_agent_id": "extraction-public-01",
  "created_at": "2026-08-23T20:22:54.194245Z",
  "evidence_candidates": [
    {
      "schema_version": "0.1.0",
      "evidence_id": "EVD-864E40645428",
      "run_id": "RUN-OFS005-PILOT-007",
      "work_item_id": "WORK-000025",
      "source_id": "SRC-15E66CBE961E",
      "source_lineage_id": "LIN-C1B2EF2A57A2",
      "source_locator": "システム構成概要、2025年システムの箇条書き",
      "excerpt": "遺伝研は第六期システムを2025年3月に稼働し、68PBのストレージ、100GbpsのSINET6接続、DGX B200・L40S・PEZY-SC3を含む計算ノード、2,000種類超のSingularityコンテナを公開している。",
      "excerpt_kind": "paraphrase",
      "statement_supported": "日本の大学・共同利用計算基盤では、異種アクセラレータ、高速ネットワーク、大容量並列ストレージ、ソフトウェア環境を統合したシステムが運用されている。",
      "status": "candidate",
      "extracted_by_agent_id": "extraction-public-01",
      "extracted_at": "2026-08-23T20:22:54.194245Z",
      "evidence_hash": "864e40645428dd30dec87fbc75a2f5f96361a19933f8189b400c282c6e8923bf"
    }
  ]
}
